{
  "absolute_runtime_path_in_canonical_identity_count": 0,
  "b7_binding": {
    "canonical_summary_sha256": "0e105e863e7abaa5b7dcf1cff24daed80efbf43c6c7723f5d28f63bc0bbde1a8",
    "decision": "FR_PREP_B7_PASS_SEALED_REAL_OBSERVATIONAL_OUTCOME_EXECUTION"
  },
  "canonical_summary_sha256": "e65d1e67d9963bae6512f37d8831eeb0bd77083dc5c9dd5a44822a0842b25f5d",
  "checkpoint": "FR_PREP_B7A",
  "conclusions": {
    "candidate": "NOT_READY_FOR_ORDER_LOGIC",
    "dataset_separation": "PROVEN",
    "descriptive_statistics": "INDEPENDENTLY_AUDITED",
    "next_allowed_scope": "OUTCOME_INTERPRETATION_CONTRACT_DESIGN_ONLY",
    "order_logic": "NOT_APPROVED",
    "performance": "NOT_EVALUATED",
    "profitability": "NOT_CLAIMED",
    "real_outcome_records": "INDEPENDENTLY_AUDITED",
    "reference_agreement": "PROVEN"
  },
  "datasets": {
    "FJ": {
      "event_status_counts": {
        "FULLY_EVALUABLE": 1059,
        "NOT_EVALUABLE": 2,
        "PARTIALLY_EVALUABLE": 18
      },
      "horizon_evaluable_counts": {
        "1": 1077,
        "12": 1059,
        "3": 1076,
        "6": 1071
      },
      "records": 1079
    },
    "FQ": {
      "event_status_counts": {
        "FULLY_EVALUABLE": 154,
        "NOT_EVALUABLE": 26,
        "PARTIALLY_EVALUABLE": 313
      },
      "horizon_evaluable_counts": {
        "1": 467,
        "12": 154,
        "3": 406,
        "6": 264
      },
      "records": 493
    }
  },
  "decision": "FR_PREP_B7A_PASS_INDEPENDENT_REAL_OUTCOME_AUDIT",
  "determinism": {
    "absolute_runtime_paths_in_identity_count": 0,
    "audit_result_sha256": {
      "normal_1": "64268ff4dc76778a5514d9a2bddb489b3ee6ae7993168ab163b00b3058006c74",
      "normal_2": "64268ff4dc76778a5514d9a2bddb489b3ee6ae7993168ab163b00b3058006c74",
      "relocated": "64268ff4dc76778a5514d9a2bddb489b3ee6ae7993168ab163b00b3058006c74"
    },
    "controlled_relocation_identical": true,
    "normal_repeat_identical": true,
    "temporary_artifacts_deleted": true
  },
  "execution_status": "PASS",
  "hash_agreement": {
    "FJ": {
      "committed_sha256": "07cb448e004d09706253c00de6823a5d93c81617eef709043cbdd478f4ac8f1e",
      "reference_sha256": "07cb448e004d09706253c00de6823a5d93c81617eef709043cbdd478f4ac8f1e"
    },
    "FQ": {
      "committed_sha256": "bdff2e961795a159e3c0b4d1730214a5a34bbc869b34544af175598e5685e0c6",
      "reference_sha256": "bdff2e961795a159e3c0b4d1730214a5a34bbc869b34544af175598e5685e0c6"
    },
    "complete": {
      "committed_sha256": "1117ab0be8fae1a8a02ef345606f62cc287c53dab3d5316607b263f055e67780",
      "reference_sha256": "1117ab0be8fae1a8a02ef345606f62cc287c53dab3d5316607b263f055e67780"
    },
    "statistics": {
      "committed_sha256": "b0f94272b133ebebc72e33f84f717316a91406abd44b72f7601b3d4f4232587c",
      "reference_sha256": "b0f94272b133ebebc72e33f84f717316a91406abd44b72f7601b3d4f4232587c"
    }
  },
  "independent_reference": {
    "adapter_call_count": 0,
    "adapter_import_count": 0,
    "b7_runner_call_count": 0,
    "b7_runner_import_count": 0,
    "implementation_location": "tools/run_fr_prep_b7a_independent_real_outcome_audit.py",
    "records_recomputed": 1572,
    "statistics_rows_recomputed": 72
  },
  "mismatch_counters": {
    "absolute_path_identity_mismatch": 0,
    "committed_b7_artifact_hash_mismatch": 0,
    "dataset_separation_mismatch": 0,
    "event_count_population_hash_or_order_mismatch": 0,
    "gap_binding_or_semantics_mismatch": 0,
    "horizon_rounding_or_canonical_policy_mismatch": 0,
    "negative_test_mismatch": 0,
    "normal_repeat_mismatch": 0,
    "record_or_statistics_hash_mismatch": 0,
    "reference_outcome_value_or_status_mismatch": 0,
    "reference_record_line_mismatch": 0,
    "relocation_mismatch": 0,
    "source_filename_row_count_or_hash_mismatch": 0,
    "statistics_value_or_row_order_mismatch": 0,
    "upstream_identity_decision_or_schema_mismatch": 0
  },
  "negative_tests": {
    "all_passed": true,
    "results": {
      "changed_b7_record_or_statistics_hash_blocked": true,
      "changed_event_count_population_hash_or_order_blocked": true,
      "changed_gap_semantics_blocked": true,
      "changed_horizon_rounding_or_canonical_policy_blocked": true,
      "changed_source_file_row_count_or_hash_blocked": true,
      "dataset_pooling_blocked": true,
      "early_parse_guard_fail_closed": true,
      "external_process_or_absolute_path_leakage_blocked": true,
      "future_ohlc_parse_before_validation_blocked": true,
      "missing_duplicate_or_reordered_record_blocked": true,
      "modified_outcome_value_or_status_blocked": true,
      "modified_statistics_value_or_row_order_blocked": true,
      "mt5_ea_network_or_external_request_blocked": true,
      "performance_threshold_optimization_or_interpretation_blocked": true,
      "prohibited_reference_import_guard_fail_closed": true,
      "reference_evaluator_adapter_or_b7_runner_import_blocked": true,
      "tp_sl_cost_cash_pl_or_order_simulation_blocked": true,
      "wrong_b7_identity_or_decision_blocked": true
    },
    "test_count": 18,
    "tests_passed": 18
  },
  "prohibited_modules": [],
  "runtime_audit": {
    "authorized_reference_audit_suite_count": 3,
    "blocked_import_requests": 2,
    "external_process": {
      "blocked_launch_count": 1,
      "successful_launch_count": 0
    },
    "future_ohlc_parse_before_validation_count": 0,
    "prohibited_execution_counts": {
      "adapter_call_count": 0,
      "b7_runner_call_count": 0,
      "cash_pl_calculation_count": 0,
      "detector_execution_count": 0,
      "ea_execution_count": 0,
      "event_population_runner_execution_count": 0,
      "external_process_success_count": 0,
      "mt5_execution_count": 0,
      "network_execution_count": 0,
      "optimization_count": 0,
      "order_simulation_count": 0,
      "outcome_interpretation_count": 0,
      "performance_threshold_count": 0,
      "profitability_claim_count": 0,
      "strategy_change_count": 0,
      "tp_sl_calculation_count": 0,
      "trading_cost_calculation_count": 0,
      "trading_readiness_claim_count": 0
    },
    "prohibited_import_counts": {
      "adapter_import_count": 0,
      "b7_runner_import_count": 0,
      "detector_import_count": 0,
      "event_population_runner_import_count": 0,
      "mt5_import_count": 0,
      "wrapper_import_count": 0
    }
  },
  "schema_version": "fr_prep_b7a_independent_real_outcome_audit.v1",
  "statistics_audit": {
    "combined_dataset_aggregation_count": 0,
    "datasets_separate": true,
    "evaluable_quantized_values_only": true,
    "interpretation_performed": false,
    "performance_threshold": null,
    "quantile_method": "R7_LINEAR_INTERPOLATION",
    "reference_row_order_and_values_match": true,
    "rows": 72
  },
  "upstream_validation": {
    "b6": {
      "canonical_summary_sha256": "83d05757947ac3398efd2956760eae7bf0ab5bac1a5722f6f7f2e2a64a551926",
      "decision": "FR_PREP_B6_PASS_OBSERVATIONAL_OUTCOME_CONTRACT_FROZEN",
      "identity_validated": true,
      "result_projection_validated": true,
      "schema_validated": true
    },
    "b6a": {
      "canonical_summary_sha256": "de18e6a1560bab3bb24ca3fd5904ead17bc75bb3665a1bcca926955b82755ece",
      "decision": "FR_PREP_B6A_PASS_SYNTHETIC_OUTCOME_ADAPTER_FIXTURES",
      "identity_validated": true,
      "result_projection_validated": true,
      "schema_validated": true
    },
    "b6b": {
      "canonical_summary_sha256": "29fa4e56626e44281dd271710d16b90b60678ee37ccf85c95cf9f17edbb32fb0",
      "decision": "FR_PREP_B6B_PASS_INDEPENDENT_SYNTHETIC_OUTCOME_ADAPTER_AUDIT",
      "identity_validated": true,
      "result_projection_validated": true,
      "schema_validated": true
    },
    "b6c": {
      "canonical_summary_sha256": "fb1f76886c662752f7d315fa89b50bb5510dfe4036a74f842baa9ebcf9ab6a4e",
      "decision": "FR_PREP_B6C_PASS_REAL_OUTCOME_EXECUTION_AUTHORIZATION_SEALED",
      "identity_validated": true,
      "result_projection_validated": true,
      "schema_validated": true
    },
    "b7": {
      "canonical_summary_sha256": "0e105e863e7abaa5b7dcf1cff24daed80efbf43c6c7723f5d28f63bc0bbde1a8",
      "decision": "FR_PREP_B7_PASS_SEALED_REAL_OBSERVATIONAL_OUTCOME_EXECUTION",
      "identity_validated": true,
      "result_projection_validated": true,
      "schema_validated": true
    }
  }
}
